{
  "app_id": "live",
  "id": "mjob_01JAB3C4D5E6F7G8H9J0K1MNPQ",
  "object_id": "med_01JAB2C3D4E5F6G7H8J9K0MNPQ",
  "type": "object.split",
  "status": "proposed",
  "params": {
    "source_size_bytes": 9663676416,
    "target_bytes": 2147483648,
    "max_bytes": 4294967296,
    "reason": "public_object_too_large",
    "parts": 5,
    "segment_seconds": 2160,
    "source_duration_seconds": 10800
  },
  "result": null,
  "error": null,
  "error_code": null,
  "attempts": 0,
  "max_attempts": 3,
  "run_after": null,
  "cancel_requested": false,
  "idempotency_key": "invariant:med_01JAB2C3D4E5F6G7H8J9K0MNPQ:object.split",
  "created_by": "system:invariant.scan",
  "owner_user_id": null,
  "decided_by": null,
  "decided_at": null,
  "created_at": "2026-09-23 18:02:11",
  "updated_at": "2026-09-23 18:02:11",
  "started_at": null,
  "finished_at": null
}
